<?xml version="1.0" encoding="UTF-8"?>
<rss version="2.0" xmlns:xsi="http://www.w3.org/2001/XMLSchema-instance"
     xsi:noNamespaceSchemaLocation="(ruta de SoporteRSS.xsd en tu proyecto)">
    <channel>
        <title>Título</title>
        <link>Enlace</link>
        <description>Descripción</description>
        <item>
            <title>El Athletic descuelga al Girona con su presión adelantada</title>
            <author>JON RIVAS</author>
            <pubDate>19/02/2024</pubDate>
            <link>https://elpais.com/deportes/futbol/2024-02-19/el-athletic-descuelga-al-girona-con-su-presion-adelantada.html</link>
            <image>https://imagenes.elpais.com/resizer/lF3VaY4AGv0Zr2Wc5wDnZJQ-9IA=/1200x0/filters:focal(1985x280:1995x290)/cloudfront-eu-central-1.images.arcpublishing.com/prisa/F6UAPXY6IFEJFJPEJ2PWBOF7IM.jpg</image>
        </item>
        <item>
            <title>Ibai se cae</title>
            <author>Ibai</author>
            <pubDate>18/12/2024</pubDate>
            <link>https://elpais.com/deportes/futbol/2024-02-19/el-athletic-descuelga-al-girona-con-su-presion-adelantada.html</link>
            <image>https://imagenes.elpais.com/resizer/lF3VaY4AGv0Zr2Wc5wDnZJQ-9IA=/1200x0/filters:focal(1985x280:1995x290)/cloudfront-eu-central-1.images.arcpublishing.com/prisa/F6UAPXY6IFEJFJPEJ2PWBOF7IM.jpg</image>
        </item>
    </channel>
</rss>
